video_id,is_primary_language,language,title,description,keywords,caption_file,audio_track_file,audio_content_type
1234,no,en,Three hundred and thirty-three,,,,,
1234,no,en,Three hundred and thirty-three,,,,,
111,no,en,twelve thousand three hundred and twelve,,,,,
123,no,en,Hello,,,,,
,no,en,"Ha ha, hello",,,,,
123,no,en,The world is so big,Volleyball is a sport that people love and hate. It's boring,Volleyball|world,The wor_en.srt,,
,no,en,One hundred and twenty-three,How do you do!,,,,
,no,en,One hundred and eleven,How do you do!,,,,
,no,en,,你好呀！很高兴认识你请多指教,,,,
,no,en,,Heihei Hei Hei hei,,,,
